artist,text
Король и шут,"караллово алый браслет
мне на прощанье подари
на шее из кровавых бус
то случиться всё равно
что должно случиться
я жду этот нежный удар
я столько лет тебя ждала
мне хочется плакать и петь
и не боюсь я не боюсь
свершилась детская мечта
что мне уже не больно…
если ждет любви оно
пусть любовь убийца
холодного лезвия след —
как отсвет розовой зари
что мне уже не страшно…
от неё не скрыться
и быть с тобой во тьме с тобой
если ждет любви оно…
что мы с тобой в мире одни
лишь ты и я и темнота
мне ничего не страшно…
волнующий миг сладкий миг
то пусть её зовут
достанется мне щедрый дар —
сердце не боится
а если вдруг явится смерть"
Король и шут,"что в рай что в ад…
как ты быстро смог
он слишком слаб
когда потоки зла и пену лжи несет река
что в ад что в рай
что порой посетители находят в них то серебряную пуговицу то золотую запонку
лондоне стали бесследно пропадать люди
что в рай что в а а ад
и каждый кто перед тобой хоть чем то виноват
что я не вправе отомстить
пирожковая сделалась модным заведением
ты как солдат бесстрашно вставший на его пути
он сам не в силах отомстить
с этой первой кровью боль моя…
и вокруг всем давно стало все равно…
пусть стоит у врат твой заклятый враг
он не сможет мне простить
тут виноват и прокурор и адвокат
не в силах боль мою вместить
он сам своих заветов ра а аб
виноват виноват каждый виноват…
по всей земле змеей ползет разврат
по темным улицам ползут чудовищные слухи а из мясорубки человеческий фарш
и что сегодня надлежит у нас считать грехом
ловетт стали пользоваться большим спросом тем более
а кто сказал
еда и жизнь полна сюрпризов
уже не светит солнце…
я буду рад стоять у врат
скажи а кто сегодня без греха
он слишком добр он слишком слаб
все сходит с рук когда вокруг
и судья продажный –
он слишком слаб…
кругом темно и даже днем в твое окно
вот наконец то прорвалась
кем бы он ни был должен должен кару понести
но кто сказал
заучить урок"
Король и шут,"что все они марионетки
прольём миру свет
актёр лицедей
передо мною вы сидите
я тут с давних пор
не ради людей
добряк и злодей
к пальцам моим
вы в зале сидите
я все секреты ваши знаю
вся жизнь спектакль
насквозь я вас вижу
я в ней актёр
а ради искусства;
кто прав а кто нет
надёжно пришиты
уколы их метки
умён и хитёр
угрозы насмешки
на лицах отметки
об этом вскоре
я роль вы сюжет
вас обманули
придворный актёр
пусть судят другие
и ваши нервы словно нити
в грязь окунули
но все они марионетки
короны примеряют пешки
а я так скромен
по жизни играю
мой мир огромен"
Король и шут,"я рад вполне
пока ты здесь
и как ветра порыв
примите роль
корни пустив
в магическом искусства алтаре
я управляю ритмами сердец  9 раз
отринув боль
великих судеб
вся жизнь словно миг
повелитель кукол жив
азартный бой
людских эмоций взрыв
в твоей игре
рад всему вполне
театра стен гранит
пока со мной ты есть
в себе свято хранит
дуэль с собой
а я ваш секундант
до капли выжму вас
и даже в смертный час
пока со мной ты здесь пока ты рядом
единый путь
несете свой талант
ты многолик"
Король и шут,"я за ней не уследил в том моя вина
и поэтому всех вас собрал сегодня я
мясом конюх угощал своих гостей
за столом сидели мужики и ели
все расхватывали ужин и хозяин весел был
конюх хриплым голосом проговорил
но скажите правда вкусная она
о чем конюх говорил они не понимали
с моей бабою встречались втайне от меня
ели мясо мужики пивом запивали
я узнал недавно  все вы как ни странно
о жене своей все время говорил"
Король и шут,"прогресс  »
о чудо из чудес
все то что эта леди намолола языком
он достиг невиданных вершин…
это мясорубка
химический процесс
какой безумный стресс
технический прогресс
ну ка ну ка
новая эпоха
а мне крутить шарманку
мы поставим агрегат на кухне
вот такая вот производи тель ность…
скорее агрегат мне разнесет подвал
новая покупка
не перемелют десять мясорубок с мясником
что это за штука
толку мало если мясо снова стухнет…
наука и прогресс приносят капитал
рубит мясо режет жилы мелет кость
вы слышали «
тогда уж сразу к ней купите обезьянку"
Король и шут,"крови крови крови крови
он достает из кармана бритву
и до поры до времени
справедливость торжествует
зуб за зуб за око око
нету в мире платы кроме
крови крови крови кро ови
с огро омной мясорубкой
все на свете серо кроме
когда то маленькой девочкой
суинни приходит на площадь
казним жестоко
но кто то останавливает его
и не хочет чтобы он снова попал за решетку
палача топор
в которую можно запихнуть целого барана
суинни открывает парикмахерскую
это настоящий праздник
она единственная узнала его
казни казни казни казни
сегодня больше чем вчера
он хочет проваться к судье
просто бреет клиентов
во время казни
в каморке над пирожковой
казни казни казни ка азни
но вот в один прекрасный день
мы накажем зло порока
появляется мясник дядя
эй палач пора
без петли и топора
но справедлив приговор
ловет была влюблена в прекрасного молодого цирюльника
за все решит топор"
Король и шут,"нынче все леприконы      а также сатиры
всю свою жизнь обитаю я в нём
они служат мне уже тысячу лет
меня называют хозяином леса
а из тела его демон вышел на свет
признают мою власть      они в этом правы
люди волки медведи     и даже вампиры
нынче все духи от феи до беса
заклинанием плоть вызываю свою
только сердце стучит уже не мое
у меня есть лес это мой дом
над кронами леса плывут облака
у меня есть нож есть арбалет
моих прошлых лет порвана нить
человек исчез его больше нет
со временем все уважать меня стали
и зеленая кровь оживляет ее
все того же охотника в ней узнаю
вечная мука
я по новому научился жить
вечная скука
если стреляю то наверняка
мне предано служат     лохматые твари
не хочет никто над собою расправы"
Король и шут,"но всё равно
читаешь сводку новостей
фосфорные краски
нет не пал духом я
темнота всё поглотила
когда то давно
во мраке их пугаю
как театр для меня
боялся страх вполне логичный
едва зайдёте
ты притупляешь разум свой
подворотня моя
луна пропала
явит ужас главному герою
и в их одобрении я не нуждаюсь
человек на вид приличный
вид зловещей маски
в подворотню он входить
боясь событий и людей
но вы не знаете об этом
прохожих изучаю
вы не умрёте
и парню стало
и опыт получаю
ответь мой друг  ты каждый день
ведь каждый может быть злодей
импровизирую играю
вновь предстаёт перед тобой
я спектакль вам устрою
не признали меня
всё по театральному сделать стараюсь
в сквере ошивался
кошмарами торгую я
и вот ты встретился со мной
и деньги требую с тебя
ещё страшней чем раньше было
ко мне прощайтесь с белым светом
и мир враждебною средой"
Король и шут,"ударил по носу локтем мерзавец стал смеяться
в ту брачную ночь у невесты прорезались клыки
его к осине привязал но тот был слишком ловкий
увлек в осиновую рощу
ого  папаше он сказал и вылез из веревки
вокруг догорающей свечки кружили мотыльки
обожаю я гулять обожаю я гулять
и шею нежную кусать
схватив за шиворот зловещего мерзавца
невеста стонала от муки отец рассвирепел
каждой жертве очень рад
и лишь кузен её погрязший гад в пороке
сломал он племяннику руки а ноги не сумел
отец был просто в шоке жених был вусмерть пьяный
все улыбался окаянный
не знал мужик каким путём от гада избавляться
и кровь моя еда
нету для меня преград нету для меня преград
к утру мужик пришел домой принес клыки злодея
бить зубы было не впервой хорошая идея
затем велел остаться с невестой мать и тещу"
Король и шут,"показывать дружно
а в сущности голые коки
бестрепетно стали
лишь наивные дети
взяла и увидела
тогда бы все начали коки
голые коки голые коки
неслыханный вздор  говорят
любимая девушка очень
беспрестанно тревожит
гораздо я глубже
стыдливое чувство меня
для женщин подобное
это мне не поможет
и к кокам тогда б относится
девчонки бы вскоре
жестоко обидела
она меня с голыми коками
от этого вида устали
не надо меня утешать
зрелище не безобразно
мне друзья и соседи
это прекрасно
стыдятся подобных вещей
но этот вопрос понимаю"
Король и шут,"и кем был я любим
как видят свет
сожжена моя свеча
пусть будет так
которой нет
когда все мертвы
она завет меня во мрак
как все потемнело
уходит страх
когда все вокруг мертвы
что ж прощайте
претворяться живым
с двух сторон сгорела
умерли давно
как свет звезды
как свет любви
те кого я любил
уходит боль
я вижу смерть
небо и земля прощай"
Король и шут,"выхожу из тьмы
но в один момент ужаснётся свет
мушкеты с порохом и смерти сериальной
что ж фокусы ложь взрослые знают умы
странные для всех обрели успех
лишь узнав о том что подвохов нет
все же для них тайны мои необъяснимы
разгадки фокусов увы весьма банальны
пролетели дни фокусы мои
и немало лет свой храня секрет
нас обмани чуда хотим видеть мы
драматичный я предложил сюжет"
Король и шут,"самый дешевый в мире обет
это лучше вонючих французких сыров
не желаете есть так ходите голодный
отбиваеются запахи выпивкой крепкой
но зато джентльмены из нашей трущебы
я бы оды писал
и уикэнд не уикэнд
и всегда тараканы отменно свежи
а без таких пирожков
британией веет
пусть сюда заходят различные снобы
мясо не свежих английских свиней
с вожделением мчтают об этом обеде
хоть не вкусное мясо но стоит гроши
нам претит запах новых кофеен
если б ты был поэт
а не пьющие нос затыкают прещепкой
это ланч и обет
а если б я был поэтом
пирожкам от
кто заходит сюда не уходит голодным
сдесь простой и суровой
смотрите какой джентльмен благородный
подзаборные леди и сопливые дети
ловетт это знает весь"
Король и шут,"и древнего рода
внушая смертным лишь кошмар
менялась природа
то день не зря будет прожит
со злобной в сумраке гримасой
и это порою нравится мне
но алое солнце снова взошло
и люди как мишени в тире
он так же кровь чужую пил
кому то поможет
столетиям не изменить
всем предстоит вам
к манерам склонны непристойным
участь слепых убивать
путь зрячих людям жить давать
лишь вид небосвода
не по закону власть дана
как представитель темной расы
повсюду со мною ученики
что они твари в этом мире
друзья понять
предатель не пойман
сверкают алые зрачки
не изменить
лишь в высшей мере недостойным
великих вампиров время прошло
теперь каждый малый
другая эпоха
порочит достойный древний наш род
не понимают новички
уподобляясь тем кто был
передают великий дар
и всякий сброд
себя утратив в жажде страстной
сейчас все неплохо
клыками стращает
в тайну других посвящает
той жизни не помню всё как во мгле
отныне изгоем быть не с руки
творил он грязные дела
бичом судьбы его несчастной
и если мой опыт"
Король и шут,"есть у меня интерес большой
глазами зверя вижу мир
ведь для меня они обед
у негодяев слаще кровь
любопытно мне
я убеждаюсь вновь и вновь
но я живу не видя дня
во мраке бесконечной ночи
и нет надежды у меня
а ну стоять дрожать бояться
откуда злобе взяться
обычно это сладкий гад
я классный парень я вампир
что называете вы душой
вся жизнь вампира сущий ад
наслаждаюсь
жертву выбираю
слабость лелея тайком свою в уме
я не кусаю всех подряд
путь мой вечен
я к людям добрый злобы нет
в гробу смыкаю свои очи
вы рады жизни я смерти рад"
Король и шут,"лишь два цвета различаю я
а в моих патронах суть моя
и своего я не помню лица
ты всё болтаешь а я всё молчу
и сбылись ли и сбылись ли
странные эти мечты
больше ничто не остановит меня
презираю этот мир
я не смел упасть
миром его называть не хочу
мы в одной могиле  «
мои мелкие радости больше не окупают неприятные
ты не веришь тоже
в этом тёмном мире
она лежала рядом
холодная как лёд
гибельна но всё же
всё то что так любил он
ты со мною я с тобою
как мы дойдём до конца
ты пушинка ты на небе
моменты той действительности которая меня окружает
чёрный и белый
что мир её однажды
в смерть не верю я
в ней больше не живёт
я же как камень и я на земле
и верил лишь тому
мы однажды оживём во снах »
жить любой ценою
он думал что он умер
на тебя гляжу во мгле
на гибель от удушья
боли не будет и развеется страх »
он шёл навстречу смерти
в могиле обрекли
мир увидит пусть увидит
ты говорила; «когда тело превратится в прах
кровь погони страсть…
откроется ему
эта западня
если сможешь то ответь
когда его враги
я бросаю вызов всем
только я и ты
и сбылись мечты
ты была со мною
что по ту сторону сна видишь ты
мёртвой рукой прикасаюсь к тебе"
Король и шут,"не пытайся скрыть
чтобы не спугнуть
чьих невольница ты идей
в то что новый твой приятель
резко изменить
свою тайну от меня
много книжек я читал
всё происходит будто в страшном сне
мне поверить не смогла
словно куклой и в час ночной
что в тебе способен он
я это видел
в чью я комнату тайком
не такой как все
теперь он может управлять тобой
очень жаль что ты тогда
много фокусов видал
меняет нелюдимая облик твой
чтобы увидеть
как бессонница в час ночной
наплевать тебе
я на цыпочках как вор
не зная ничего о нём
и находиться здесь опасно мне
ты осталась с ним вдвоём
зачем тебе охотиться на людей
крестик на моей груди
тех кто спит уже давно
он загубил таких как ты не одну
пробираюсь чуть дыша
тёмный мрачный коридор
на него ты погляди
и ты попала
к настоящему колдуну
тех кому не всё равно
что для всех опасен он
желаю заглянуть"
Король и шут,"и юное тело поплыло по
пока ее муж был закован в железе
возвращается в родной город
о юной прекрасной красавице
был бедный цирюльник на каторгу сослан
и нету баллады печальней на свете
расчет у судьи был безжалостно точный
ужасней истории вы не найдете
он дело состряпал по ложным доносам
после двадцатилетней каторги
невинно осужденный
но раз возвращаясь домой после казни
бетти прекрасной
красавицу встретил судья похотливый
чем эта о бедном цирюльнике
о юной прекрасной
и вот разлученный с женою и дочкой
печальней истории вы не найдете
и юной прекрасной жене его
и бросилась в реку она на рассвете
с надеждой в сердце и бритвой в кармане
он узнает что его жена покончила с собой
с малюткою дочкой и
таймс» ни в другой ежедневной газете
а малютка дочь бесследно пропала
о юной прекрасной жене его
мерзавец судья домогался до
жил в доме уютном цирюльник счастливый"
Король и шут,"сколько мне осталось дней
валет а над ним ужасная
с ножом вруке
обратился парень кней
и блеснул во мраке нож и раздался хохот
что ты хочешь мне сказать я не понимаю
и у тихого пруда повстречал гадалку
с ножом вруке hа тело ведьма покосилась
и воскликнул здоровяк руки потирая
прямо щас и прямо здесь будет тебе плохо
шел с улыбкой здоровяк по ночному парку
и упали карты на снег и старуха парню сказала
и упало тело на снег и старуха парню сказала
сквозь хриплый смех
весь в крови несчастный
как скажи умру я
вот что знать хочу я
и в неизвестном направленьи"
